[
  { "name": "BORDER",          "aci_color": 7,  "linetype": "CONTINUOUS", "lineweight_mm": 0.50, "discipline": "shared", "purpose": "Drawing sheet border",             "mandatory": true },
  { "name": "TITLE_BLOCK",     "aci_color": 7,  "linetype": "CONTINUOUS", "lineweight_mm": 0.35, "discipline": "shared", "purpose": "Title block frame",                "mandatory": true },
  { "name": "TITLE_TEXT",      "aci_color": 7,  "linetype": "CONTINUOUS", "lineweight_mm": 0.25, "discipline": "shared", "purpose": "Title block text fields",          "mandatory": true },
  { "name": "GRID",            "aci_color": 3,  "linetype": "CENTER",     "lineweight_mm": 0.18, "discipline": "shared", "purpose": "Structural/reference grid",        "mandatory": true },
  { "name": "GRID_LABELS",     "aci_color": 3,  "linetype": "CONTINUOUS", "lineweight_mm": 0.18, "discipline": "shared", "purpose": "Grid axis labels",                "mandatory": true },
  { "name": "NOTES",           "aci_color": 7,  "linetype": "CONTINUOUS", "lineweight_mm": 0.25, "discipline": "shared", "purpose": "General notes",                    "mandatory": true },
  { "name": "NORTH_ARROW",     "aci_color": 7,  "linetype": "CONTINUOUS", "lineweight_mm": 0.25, "discipline": "shared", "purpose": "North arrow",                       "mandatory": false },
  { "name": "SCALE_BAR",       "aci_color": 7,  "linetype": "CONTINUOUS", "lineweight_mm": 0.25, "discipline": "shared", "purpose": "Graphic scale bar",                 "mandatory": false },
  { "name": "REVISION_TABLE",  "aci_color": 7,  "linetype": "CONTINUOUS", "lineweight_mm": 0.25, "discipline": "shared", "purpose": "Revision history",                  "mandatory": true },

  { "name": "STR-FND-OUTLINE",       "aci_color": 7,  "linetype": "CONTINUOUS", "lineweight_mm": 0.50, "discipline": "structural", "element_types": ["isolated_footing","strip_footing","combined_footing","grade_beam"], "purpose": "Foundation outer boundary",    "mandatory": true },
  { "name": "STR-FND-COLUMN",        "aci_color": 7,  "linetype": "CONTINUOUS", "lineweight_mm": 0.50, "discipline": "structural", "element_types": ["isolated_footing","strip_footing","combined_footing"],              "purpose": "Column section on foundation",  "mandatory": true },
  { "name": "STR-FND-REBAR-BOT",     "aci_color": 1,  "linetype": "CONTINUOUS", "lineweight_mm": 0.35, "discipline": "structural", "element_types": ["isolated_footing","strip_footing","combined_footing","grade_beam"], "purpose": "Bottom reinforcement",         "mandatory": true },
  { "name": "STR-FND-REBAR-TOP",     "aci_color": 1,  "linetype": "CONTINUOUS", "lineweight_mm": 0.35, "discipline": "structural", "element_types": ["isolated_footing","strip_footing","combined_footing","grade_beam"], "purpose": "Top reinforcement",            "mandatory": false },
  { "name": "STR-FND-REBAR-STIRRUP", "aci_color": 1,  "linetype": "CONTINUOUS", "lineweight_mm": 0.25, "discipline": "structural", "element_types": ["grade_beam"],                                                       "purpose": "Stirrups",                      "mandatory": true },
  { "name": "STR-FND-DIMS",          "aci_color": 2,  "linetype": "CONTINUOUS", "lineweight_mm": 0.25, "discipline": "structural", "element_types": ["isolated_footing","strip_footing","combined_footing","grade_beam"], "purpose": "Dimensions",                    "mandatory": true },
  { "name": "STR-FND-HATCH",         "aci_color": 6,  "linetype": "CONTINUOUS", "lineweight_mm": 0.18, "discipline": "structural", "element_types": ["isolated_footing","strip_footing","combined_footing","grade_beam"], "purpose": "Concrete hatch",               "mandatory": true },
  { "name": "STR-FND-SOIL",          "aci_color": 8,  "linetype": "DASHED",     "lineweight_mm": 0.18, "discipline": "structural", "element_types": ["isolated_footing","strip_footing","combined_footing","grade_beam"], "purpose": "Ground/soil line",             "mandatory": true },
  { "name": "STR-FND-CENTERLINE",    "aci_color": 251,"linetype": "CENTER",     "lineweight_mm": 0.18, "discipline": "structural", "element_types": ["isolated_footing","strip_footing","combined_footing","grade_beam"], "purpose": "Centerlines",                  "mandatory": true },
  { "name": "STR-FND-ANNOTATIONS",   "aci_color": 7,  "linetype": "CONTINUOUS", "lineweight_mm": 0.25, "discipline": "structural", "element_types": ["isolated_footing","strip_footing","combined_footing","grade_beam"], "purpose": "Rebar callouts, cover notes",   "mandatory": true },

  { "name": "STR-COL-OUTLINE",       "aci_color": 7,  "linetype": "CONTINUOUS", "lineweight_mm": 0.50, "discipline": "structural", "element_types": ["column"], "purpose": "Column outline",             "mandatory": true },
  { "name": "STR-COL-REBAR-MAIN",    "aci_color": 1,  "linetype": "CONTINUOUS", "lineweight_mm": 0.35, "discipline": "structural", "element_types": ["column"], "purpose": "Longitudinal bars",         "mandatory": true },
  { "name": "STR-COL-REBAR-TIES",    "aci_color": 1,  "linetype": "CONTINUOUS", "lineweight_mm": 0.25, "discipline": "structural", "element_types": ["column"], "purpose": "Ties",                       "mandatory": true },
  { "name": "STR-COL-DIMS",          "aci_color": 2,  "linetype": "CONTINUOUS", "lineweight_mm": 0.25, "discipline": "structural", "element_types": ["column"], "purpose": "Dimensions",                 "mandatory": true },
  { "name": "STR-COL-HATCH",         "aci_color": 6,  "linetype": "CONTINUOUS", "lineweight_mm": 0.18, "discipline": "structural", "element_types": ["column"], "purpose": "Concrete hatch",            "mandatory": true },
  { "name": "STR-COL-CENTERLINE",    "aci_color": 251,"linetype": "CENTER",     "lineweight_mm": 0.18, "discipline": "structural", "element_types": ["column"], "purpose": "Centerlines",               "mandatory": true },
  { "name": "STR-COL-ANNOTATIONS",   "aci_color": 7,  "linetype": "CONTINUOUS", "lineweight_mm": 0.25, "discipline": "structural", "element_types": ["column"], "purpose": "Bar schedule callouts",    "mandatory": true },

  { "name": "STR-BM-OUTLINE",        "aci_color": 7,  "linetype": "CONTINUOUS", "lineweight_mm": 0.50, "discipline": "structural", "element_types": ["beam","grade_beam"], "purpose": "Beam outline",            "mandatory": true },
  { "name": "STR-BM-REBAR-TOP",      "aci_color": 1,  "linetype": "CONTINUOUS", "lineweight_mm": 0.35, "discipline": "structural", "element_types": ["beam","grade_beam"], "purpose": "Top bars",               "mandatory": true },
  { "name": "STR-BM-REBAR-BOT",      "aci_color": 1,  "linetype": "CONTINUOUS", "lineweight_mm": 0.35, "discipline": "structural", "element_types": ["beam","grade_beam"], "purpose": "Bottom bars",            "mandatory": true },
  { "name": "STR-BM-REBAR-STIRRUP",  "aci_color": 1,  "linetype": "CONTINUOUS", "lineweight_mm": 0.25, "discipline": "structural", "element_types": ["beam","grade_beam"], "purpose": "Stirrups",               "mandatory": true },
  { "name": "STR-BM-DIMS",           "aci_color": 2,  "linetype": "CONTINUOUS", "lineweight_mm": 0.25, "discipline": "structural", "element_types": ["beam","grade_beam"], "purpose": "Dimensions",             "mandatory": true },
  { "name": "STR-BM-HATCH",          "aci_color": 6,  "linetype": "CONTINUOUS", "lineweight_mm": 0.18, "discipline": "structural", "element_types": ["beam","grade_beam"], "purpose": "Concrete hatch",        "mandatory": true },
  { "name": "STR-BM-CENTERLINE",     "aci_color": 251,"linetype": "CENTER",     "lineweight_mm": 0.18, "discipline": "structural", "element_types": ["beam","grade_beam"], "purpose": "Beam centerline",        "mandatory": true },
  { "name": "STR-BM-ANNOTATIONS",    "aci_color": 7,  "linetype": "CONTINUOUS", "lineweight_mm": 0.25, "discipline": "structural", "element_types": ["beam","grade_beam"], "purpose": "Span and support notes",  "mandatory": true },

  { "name": "ARC-WALL-EXT",       "aci_color": 7, "linetype": "CONTINUOUS", "lineweight_mm": 0.50, "discipline": "architectural", "element_types": ["floor_plan"], "purpose": "External walls",       "mandatory": true },
  { "name": "ARC-WALL-INT",       "aci_color": 7, "linetype": "CONTINUOUS", "lineweight_mm": 0.35, "discipline": "architectural", "element_types": ["floor_plan"], "purpose": "Internal partitions",  "mandatory": true },
  { "name": "ARC-DOOR",          "aci_color": 7, "linetype": "CONTINUOUS", "lineweight_mm": 0.35, "discipline": "architectural", "element_types": ["floor_plan"], "purpose": "Door symbols",         "mandatory": true },
  { "name": "ARC-WINDOW",        "aci_color": 7, "linetype": "CONTINUOUS", "lineweight_mm": 0.35, "discipline": "architectural", "element_types": ["floor_plan"], "purpose": "Window symbols",      "mandatory": true },
  { "name": "ARC-COLUMN",        "aci_color": 7, "linetype": "CONTINUOUS", "lineweight_mm": 0.50, "discipline": "architectural", "element_types": ["floor_plan"], "purpose": "Column outlines",     "mandatory": true },
  { "name": "ARC-DIMS",          "aci_color": 2, "linetype": "CONTINUOUS", "lineweight_mm": 0.25, "discipline": "architectural", "element_types": ["floor_plan"], "purpose": "All dimensions",      "mandatory": true },
  { "name": "ARC-ROOM-LABELS",   "aci_color": 7, "linetype": "CONTINUOUS", "lineweight_mm": 0.25, "discipline": "architectural", "element_types": ["floor_plan"], "purpose": "Room names/areas",    "mandatory": true },
  { "name": "ARC-HATCH-WALL",    "aci_color": 6, "linetype": "CONTINUOUS", "lineweight_mm": 0.18, "discipline": "architectural", "element_types": ["floor_plan"], "purpose": "Wall cut hatch",      "mandatory": true },
  { "name": "ARC-ANNOTATIONS",   "aci_color": 7, "linetype": "CONTINUOUS", "lineweight_mm": 0.25, "discipline": "architectural", "element_types": ["floor_plan"], "purpose": "General annotations", "mandatory": true },